{
  "$schema": "./autocode.schema.json",
  "conventions": {
    "servicePattern": "*Service",
    "repositoryPattern": "*Repository",
    "dtoSuffix": "Dto",
    "autoDetectServices": true,
    "autoDetectDtos": true,
    "autoDetectRepositories": true,
    "autoDetectControllers": false
  },
  "mapper": {
    "methodName": "MapTo",
    "nullHandling": "Skip",
    "collectionMapping": "DeepCopy",
    "generateProjection": false
  },
  "dto": {
    "useRecord": false,
    "excludeAuditFields": true
  },
  "webapi": {
    "responseWrapper": true,
    "pagination": true,
    "versioning": "UrlSegment",
    "version": ""
  },
  "validation": {
    "generateFluentStyle": false,
    "enableAsyncValidation": false
  },
  "dependencyInjection": {
    "namespace": "AutoCode.DependencyInjection",
    "methodName": "AddAutoDI",
    "modulePerAssembly": false
  },
  "cascade": {
    "dto": true,
    "mapper": true,
    "validation": true,
    "repository": true,
    "service": true,
    "controller": true,
    "tests": false,
    "logging": false
  },
  "logging": {
    "structuredLogging": true,
    "includeOpenTelemetry": false,
    "maskSensitive": true
  },
  "intercept": {
    "defaultInterceptors": "Log,Metrics",
    "cacheDurationSeconds": 300,
    "maxRetryCount": 3,
    "retryBaseDelayMs": 100,
    "circuitFailureThreshold": 5,
    "circuitBreakDurationSeconds": 30
  },
  "plugins": {
    "interface": { "enabled": true },
    "mapper": { "enabled": true },
    "dto": { "enabled": true },
    "validation": { "enabled": true },
    "webapi": { "enabled": true },
    "crud": { "enabled": true },
    "dependencyInjection": { "enabled": true },
    "testing": { "enabled": true },
    "logging": { "enabled": true },
    "cascade": { "enabled": true },
    "intercept": { "enabled": true }
  },
  "customGenerators": [
    {
      "name": "auditService",
      "title": "添加审计日志服务",
      "icon": "📝",
      "category": "Service",
      "trigger": {
        "classPattern": "*Service",
        "attributeName": "AutoAudit"
      },
      "output": {
        "template": "templates/AuditService.liquid",
        "fileName": "{ClassName}Audit.g.cs",
        "namespace": "{SourceNamespace}.Audit"
      }
    },
    {
      "name": "repositoryPattern",
      "title": "生成 Repository 实现",
      "icon": "🗂️",
      "category": "Entity",
      "trigger": {
        "requiredProperties": ["Id"],
        "attributeName": "AutoRepository"
      },
      "output": {
        "template": "templates/Repository.liquid",
        "fileName": "{ClassName}Repository.g.cs",
        "namespace": "{SourceNamespace}.Data"
      }
    }
  ]
}
